{
  "$schema" : "http://json-schema.org/draft-07/schema#",
  "type" : "object",
  "properties" : {
    "@context" : {
      "type" : "array",
      "items" : {
        "type" : "string"
      }
    },
    "billing" : {
      "type" : "object",
      "properties" : {
        "paymentModel" : {
          "type" : "object",
          "properties" : {
            "frequenceOfPayment" : {
              "type" : "string"
            },
            "unit" : {
              "type" : "string"
            },
            "value" : {
              "type" : "string"
            }
          },
          "additionalProperties" : false
        },
        "price" : {
          "type" : "string"
        },
        "unit" : {
          "type" : "string"
        }
      },
      "additionalProperties" : false
    },
    "credentialSchema" : {
      "type" : "object",
      "properties" : {
        "id" : {
          "type" : "string"
        },
        "type" : {
          "type" : "string"
        }
      },
      "additionalProperties" : false
    },
    "credentialSubject" : {
      "type" : "object",
      "properties" : {
        "dependsOn" : {
          "type" : "array",
          "items" : {
            "type" : "string"
          }
        },
        "description" : {
          "type" : "string"
        },
        "hasCertifications" : {
          "type" : "array",
          "items" : {
            "type" : "string"
          }
        },
        "hasMarketingImage" : {
          "type" : "string"
        },
        "hasName" : {
          "type" : "string"
        },
        "hasVersion" : {
          "type" : "string"
        },
        "id" : {
          "type" : "string"
        },
        "providedBy" : {
          "type" : "string"
        },
        "type" : {
          "type" : "string"
        },
        "utilizes" : {
          "type" : "array",
          "items" : {
            "type" : "string"
          }
        }
      },
      "additionalProperties" : false
    },
    "description" : {
      "type" : "string"
    },
    "expirationDate" : {
      "type" : "string"
    },
    "id" : {
      "type" : "string"
    },
    "issuanceDate" : {
      "type" : "string"
    },
    "issuer" : {
      "type" : "string"
    },
    "keywords" : {
      "type" : "array",
      "items" : {
        "type" : "string"
      }
    },
    "modified" : {
      "type" : "string"
    },
    "proof" : {
      "type" : "object",
      "properties" : {
        "created" : {
          "type" : "string"
        },
        "creator" : {
          "type" : "string"
        },
        "domain" : {
          "type" : "string"
        },
        "jws" : {
          "type" : "string"
        },
        "nonce" : {
          "type" : "string"
        },
        "proofPurpose" : {
          "type" : "string"
        },
        "type" : {
          "type" : "string"
        },
        "verificationMethod" : {
          "type" : "string"
        }
      },
      "additionalProperties" : false
    },
    "providedBy" : {
      "type" : "string"
    },
    "provisionType" : {
      "type" : "string"
    },
    "serviceModel" : {
      "type" : "string"
    },
    "serviceTitle" : {
      "type" : "string"
    },
    "type" : {
      "type" : "array",
      "items" : {
        "type" : "string"
      }
    },
    "validFrom" : {
      "type" : "string"
    },
    "version" : {
      "type" : "string"
    },
    "webAddress" : {
      "type" : "string"
    }
  },
  "required" : [ "@context", "type" ],
  "additionalProperties" : false
}